id,question_en,question_ru,answer_en,answer_ru,tags,sources,safety_level,question_en_clean,question_ru_clean,combined_question
286,What happens on day 3 of dengue?,Dengue ke din 3 me kya hota hai?,Platelets may drop and fever may remain high.,Platelets girna shuru hosakte hain aur bukhar barha reh sakta hai.,timeline,WHO,general,what happens on day 3 of dengue,dengue ke din 3 me kya hota hai,what happens on day 3 of dengue dengue ke din 3 me kya hota hai
287,What happens on day 5?,Din 5 me kya hota hai?,Fever often begins to fall; critical phase may start.,Bukhar girna shuru hota hai; critical phase shuru hosakti hai.,timeline;critical_phase,WHO,general,what happens on day 5,din 5 me kya hota hai,what happens on day 5 din 5 me kya hota hai
288,What happens on day 7?,Din 7 me kya hota hai?,Most patients exit the critical phase and begin recovery.,Aksar log critical phase se nikal kar recovery me jate hain.,timeline;recovery,WHO,general,what happens on day 7,din 7 me kya hota hai,what happens on day 7 din 7 me kya hota hai
289,Can dengue last more than a week?,Kya dengue aik haftay se zyada rehta hai?,"Yes, recovery and fatigue may extend into weeks.","Haan, recovery aur thakan hafton tak ja sakti hai.",timeline;recovery,WHO,general,can dengue last more than a week,kya dengue aik haftay se zyada rehta hai,can dengue last more than a week kya dengue aik haftay se zyada rehta hai
290,Does dengue affect sleep?,Kya dengue neend ko asar karta hai?,"Yes, fever and pain disturb sleep.","Haan, bukhar aur dard neend ko kharab karte hain.",symptoms;sleep,Clinical,general,does dengue affect sleep,kya dengue neend ko asar karta hai,does dengue affect sleep kya dengue neend ko asar karta hai
291,Can dengue cause tingling?,Kya dengue me tingling mehsoos hoti hai?,Rare but possible with dehydration or electrolyte imbalance.,Kam hota hai lekin dehydration ya imbalance se.,symptoms;neuro,Clinical,general,can dengue cause tingling,kya dengue me tingling mehsoos hoti hai,can dengue cause tingling kya dengue me tingling mehsoos hoti hai
292,Does dengue cause swollen lips?,Kya dengue me hont sooj jate hain?,"Uncommon; if swelling occurs, seek evaluation.",Kam hota hai; ho to muaina karein.,symptoms;swelling,Clinical,general,does dengue cause swollen lips,kya dengue me hont sooj jate hain,does dengue cause swollen lips kya dengue me hont sooj jate hain
293,Does dengue cause fever spikes?,Kya dengue me bukhar achanak barhta hai?,"Yes, fever may rise suddenly in early days.","Haan, shuru me bukhar achanak barh sakta hai.",symptoms;fever,WHO,general,does dengue cause fever spikes,kya dengue me bukhar achanak barhta hai,does dengue cause fever spikes kya dengue me bukhar achanak barhta hai
294,Does dengue cause red eyes?,Kya dengue me aankhen surkh hoti hain?,Mild redness may occur in some patients.,Kuch logon me halki surkhi hosakti hai.,symptoms;eye,Clinical,general,does dengue cause red eyes,kya dengue me aankhen surkh hoti hain,does dengue cause red eyes kya dengue me aankhen surkh hoti hain
295,Is extreme thirst normal?,Kya bohat pyaas dengue me aam hai?,"Yes, due to dehydration from fever.","Haan, bukhar se dehydration hoti hai jo pyaas barhati hai.",hydration;symptoms,WHO,general,is extreme thirst normal,kya bohat pyaas dengue me aam hai,is extreme thirst normal kya bohat pyaas dengue me aam hai
296,Does dengue cause shakiness?,Kya dengue me komp hota hai?,"Yes, chills can cause shaking.","Haan, kapkapi se komp hosakta hai.",symptoms;fever,WHO,general,does dengue cause shakiness,kya dengue me komp hota hai,does dengue cause shakiness kya dengue me komp hota hai
297,Can dengue cause rapid breathing?,Kya dengue me tez saans hoti hai?,"Yes, often due to dehydration or respiratory involvement.","Haan, dehydration ya respiratory maslay se.",symptoms;respiratory,WHO,general,can dengue cause rapid breathing,kya dengue me tez saans hoti hai,can dengue cause rapid breathing kya dengue me tez saans hoti hai
298,Is low BP normal in dengue?,Kya kam blood pressure dengue me normal hota hai?,"No, low BP suggests severe disease.","Nahi, kam BP severe dengue ki nishani hai.",warning_signs;BP,WHO,general,is low bp normal in dengue,kya kam blood pressure dengue me normal hota hai,is low bp normal in dengue kya kam blood pressure dengue me normal hota hai
299,Does dengue affect urine color?,Kya dengue me peshab ka rang badalta hai?,"Yes, dark urine indicates dehydration.","Haan, ghana rang dehydration dikhata hai.",hydration;monitoring,WHO,general,does dengue affect urine color,kya dengue me peshab ka rang badalta hai,does dengue affect urine color kya dengue me peshab ka rang badalta hai
300,Can dengue cause swelling around eyes?,Kya dengue me aankhon ke gird soojan hoti hai?,Mild swelling may occur; severe swelling needs medical evaluation.,Halki soojan hosakti hai; shadeed soojan par muaina zaruri hai.,symptoms;eye,Clinical,general,can dengue cause swelling around eyes,kya dengue me aankhon ke gird soojan hoti hai,can dengue cause swelling around eyes kya dengue me aankhon ke gird soojan hoti hai
301,Do Aedes mosquitoes breed indoors?,Kya Aedes machar ghar ke andar breed karte hain?,"Yes, they commonly breed in indoor containers with clean stagnant water.","Haan, yeh aksar ghar ke andar saaf ruke pani ke bartanon me breed karte hain.",vector;breeding,WHO,general,do aedes mosquitoes breed indoors,kya aedes machar ghar ke andar breed karte hain,do aedes mosquitoes breed indoors kya aedes machar ghar ke andar breed karte hain
302,Can Aedes breed in plant trays?,Kya Aedes ghamlon ki tray me breed karta hai?,"Yes, plant trays and small water collections are major breeding hotspots.","Haan, ghamlon ki trays machron ki barray breeding hotspots hoti hain.",vector_control;household,WHO,general,can aedes breed in plant trays,kya aedes ghamlon ki tray me breed karta hai,can aedes breed in plant trays kya aedes ghamlon ki tray me breed karta hai
303,How far can Aedes mosquitoes fly?,Aedes machar kitna door urta hai?,They typically fly 100–200 meters around homes.,Aam tor par yeh 100–200 meter tak gharon ke aas paas urtay hain.,vector;behavior,WHO,general,how far can aedes mosquitoes fly,aedes machar kitna door urta hai,how far can aedes mosquitoes fly aedes machar kitna door urta hai
304,Do Aedes mosquitoes prefer humans?,Kya Aedes machar insano ko zyada pasand karta hai?,"Yes, Aedes aegypti prefers human blood and lives near households.","Haan, Aedes aegypti insani khoon pasand karta hai aur gharon ke qareeb rehta hai.",vector;behavior,WHO,general,do aedes mosquitoes prefer humans,kya aedes machar insano ko zyada pasand karta hai,do aedes mosquitoes prefer humans kya aedes machar insano ko zyada pasand karta hai
305,Are Aedes active at night?,Kya Aedes raat ko active hotay hain?,"They mainly bite during the day, but low-level activity at night can occur indoors.","Yeh zyada tar din me kaat-te hain, magar ghar ke andar raat ko halki activity hosakti hai.",vector;behavior,WHO,general,are aedes active at night,kya aedes raat ko active hotay hain,are aedes active at night kya aedes raat ko active hotay hain
306,Can mosquito larvae survive in dirty drains?,Kya machar ke larvey ganday drains me zinda rehte hain?,Aedes prefer clean stagnant water; dirty drains mostly breed other mosquitoes.,Aedes saaf ruka pani pasand karte hain; ganday drains me aam tor par doosri qisam ke machar hote hain.,breeding;vector,WHO,general,can mosquito larvae survive in dirty drains,kya machar ke larvey ganday drains me zinda rehte hain,can mosquito larvae survive in dirty drains kya machar ke larvey ganday drains me zinda rehte hain
307,How often should water tanks be cleaned?,Water tank kitni dafa saaf karna chahiye?,Clean and cover tanks weekly to prevent larvae.,Tankiyon ko hafte me aik martaba saaf aur dhak karen.,household;vector_control,Public health,general,how often should water tanks be cleaned,water tank kitni dafa saaf karna chahiye,how often should water tanks be cleaned water tank kitni dafa saaf karna chahiye
308,Does chlorine kill mosquito larvae?,Kya chlorine larva ko marta hai?,"Strong chlorine can kill larvae, but source reduction is more reliable.",Tez chlorine larva ko mar sakti hai magar ruka pani khatam karna zyada moassar hai.,vector_control;chemicals,Public health,general,does chlorine kill mosquito larvae,kya chlorine larva ko marta hai,does chlorine kill mosquito larvae kya chlorine larva ko marta hai
309,Do fish reduce larvae?,Kya machhliyan larva ko kam karte hain?,"Some fish species eat larvae in ponds, but not suitable for household containers.",Kuch machhliyan talab me larva khati hain magar ghar ke bartanon me yeh amli nahi.,vector_control;biologic,Public health,general,do fish reduce larvae,kya machhliyan larva ko kam karte hain,do fish reduce larvae kya machhliyan larva ko kam karte hain
310,Is fogging harmful to pets?,Kya fogging pets ke liye nuqsan deh hai?,Pets should stay indoors during fogging; ventilation afterward is important.,Fogging ke douran pets ko andar rakhein; baad me kamra hawadar karein.,vector_control;community,Public health,general,is fogging harmful to pets,kya fogging pets ke liye nuqsan deh hai,is fogging harmful to pets kya fogging pets ke liye nuqsan deh hai
311,Can dengue spread through contaminated water?,Kya dengue pani se phailta hai?,No. It spreads only through infected Aedes mosquito bites.,Nahi. Ye sirf machar ke kaat se phailta hai.,transmission,WHO,general,can dengue spread through contaminated water,kya dengue pani se phailta hai,can dengue spread through contaminated water kya dengue pani se phailta hai
312,Can dengue spread through food?,Kya dengue khane se lagta hai?,"No, food does not transmit dengue.","Nahi, khana dengue nahi phailata.",transmission,WHO,general,can dengue spread through food,kya dengue khane se lagta hai,can dengue spread through food kya dengue khane se lagta hai
313,Is dengue airborne?,Kya dengue hawa se phailta hai?,"No, dengue is not airborne.","Nahi, dengue hawa se nahi phailta.",transmission,WHO,general,is dengue airborne,kya dengue hawa se phailta hai,is dengue airborne kya dengue hawa se phailta hai
314,Can dengue spread by touch?,Kya dengue haath milane se lagta hai?,"No, casual contact does not spread dengue.","Nahi, aam rabt se dengue nahi lagta.",transmission,WHO,general,can dengue spread by touch,kya dengue haath milane se lagta hai,can dengue spread by touch kya dengue haath milane se lagta hai
315,Can dengue spread by sharing utensils?,Kya bartan share karne se dengue hota hai?,"No, it requires a mosquito vector.","Nahi, dengue ke liye machar zaruri hota hai.",transmission,WHO,general,can dengue spread by sharing utensils,kya bartan share karne se dengue hota hai,can dengue spread by sharing utensils kya bartan share karne se dengue hota hai
316,Do all mosquitoes spread dengue?,Kya har machar dengue phailata hai?,"No, mainly Aedes aegypti and Aedes albopictus spread dengue.","Nahi, sirf Aedes aegypti aur Aedes albopictus.",vector;transmission,WHO,general,do all mosquitoes spread dengue,kya har machar dengue phailata hai,do all mosquitoes spread dengue kya har machar dengue phailata hai
317,Why do Aedes stay near homes?,Aedes gharon ke paas kyun rehte hain?,"They prefer human environments, shade, and indoor containers.","Yeh insani muhit, saya aur ghar ke bartanon ko pasand karte hain.",vector;behavior,WHO,general,why do aedes stay near homes,aedes gharon ke paas kyun rehte hain,why do aedes stay near homes aedes gharon ke paas kyun rehte hain
318,Do Aedes lay eggs in small water amounts?,Kya Aedes thori si matra me pani me anday deta hai?,"Yes, even bottle caps can support larvae.","Haan, bottle cap jitna pani bhi larva banane ke liye kafi hota hai.",breeding;vector_control,Public health,general,do aedes lay eggs in small water amounts,kya aedes thori si matra me pani me anday deta hai,do aedes lay eggs in small water amounts kya aedes thori si matra me pani me anday deta hai
319,How long do Aedes eggs survive?,Aedes ke anday kitna arsa zinda rehte hain?,Dry eggs can survive months and hatch when water returns.,Sookhay anday mahino tak zinda rehte hain aur pani lagtay hi hatch hotay hain.,vector;breeding,WHO,general,how long do aedes eggs survive,aedes ke anday kitna arsa zinda rehte hain,how long do aedes eggs survive aedes ke anday kitna arsa zinda rehte hain
320,Is colored water safe from larvae?,Kya rang wala pani larva se mehfooz hota hai?,"No, larvae can survive in colored but clean stagnant water.","Nahi, rang hone par bhi agar pani saaf ruka ho to larva reh sakta hai.",breeding,Public health,general,is colored water safe from larvae,kya rang wala pani larva se mehfooz hota hai,is colored water safe from larvae kya rang wala pani larva se mehfooz hota hai
321,Can mosquito larvae climb?,Kya larva container ki diwar chadh sakta hai?,"No, larvae stay in water but pupae may float at surface.","Nahi, larva pani me rehta hai; pupae satah par tair sakte hain.",vector;biology,Public health,general,can mosquito larvae climb,kya larva container ki diwar chadh sakta hai,can mosquito larvae climb kya larva container ki diwar chadh sakta hai
322,How to identify mosquito larvae?,Machar ke larva ko kaise pehchane?,They look like small wiggling worms in stagnant water.,Yeh ruke pani me chhotay hiltay larway jaisay lagtay hain.,breeding;identification,Public health,general,how to identify mosquito larvae,machar ke larva ko kaise pehchane,how to identify mosquito larvae machar ke larva ko kaise pehchane
323,Do mosquito eggs float?,Kya machar ke anday tairtay hain?,Aedes eggs stick to container walls near the waterline.,Aedes ke anday bartanon ki diwar se chipak kar lagay jate hain.,vector;breeding,Public health,general,do mosquito eggs float,kya machar ke anday tairtay hain,do mosquito eggs float kya machar ke anday tairtay hain
324,How long before larvae become adult mosquitoes?,Larva ko machar banne me kitna waqt lagta hai?,Usually 7–10 days depending on temperature.,"Aksar 7–10 din lagtay hain, darja-hararat par depend karta hai.",vector;cycle,WHO,general,how long before larvae become adult mosquitoes,larva ko machar banne me kitna waqt lagta hai,how long before larvae become adult mosquitoes larva ko machar banne me kitna waqt lagta hai
325,Can sun exposure kill larvae?,Kya dhoop larva ko marta hai?,Direct sunlight reduces survival but is not reliable for full control.,Seedhi dhoop survival kam karti hai magar mukammal hal nahi.,vector_control,Public health,general,can sun exposure kill larvae,kya dhoop larva ko marta hai,can sun exposure kill larvae kya dhoop larva ko marta hai
326,Does salt water kill larvae?,Kya namak wala pani larva ko marta hai?,Aedes eggs survive in fresh water; salt concentration must be very high to kill larvae.,Aedes ke anday meetha pani pasand karte hain; zyada namak larva ko mar sakta hai magar home use ke liye amli nahi.,breeding;chemicals,Public health,general,does salt water kill larvae,kya namak wala pani larva ko marta hai,does salt water kill larvae kya namak wala pani larva ko marta hai
327,Do essential oils repel Aedes?,Kya essential oils Aedes ko door rakhte hain?,"Some oils repel mildly, but DEET and picaridin are more reliable.",Kuch oils halki rok lagate hain magar DEET/picaridin zyada moassar hain.,repellents,WHO,general,do essential oils repel aedes,kya essential oils aedes ko door rakhte hain,do essential oils repel aedes kya essential oils aedes ko door rakhte hain
328,Can dengue cause dehydration quickly?,Kya dengue me dehydration jaldi hoti hai?,"Yes, due to fever, vomiting, and poor intake.","Haan, bukhar, ulti aur kam pani pine se.",hydration,WHO,urgent-care,can dengue cause dehydration quickly,kya dengue me dehydration jaldi hoti hai,can dengue cause dehydration quickly kya dengue me dehydration jaldi hoti hai
329,Is coconut water useful?,Kya nariyal pani faidemand hai?,"Yes, it helps hydration but does not replace ORS.","Haan, hydration me madad karta hai magar ORS ka badal nahi.",hydration;nutrition,Education,general,is coconut water useful,kya nariyal pani faidemand hai,is coconut water useful kya nariyal pani faidemand hai
330,Are isotonic drinks safe?,Kya sports drinks dengue me theek hain?,Safe if diluted; avoid high sugar.,Dilute kar ke theek hain; zyada meetha nuqsan day ho sakta hai.,hydration;nutrition,Education,general,are isotonic drinks safe,kya sports drinks dengue me theek hain,are isotonic drinks safe kya sports drinks dengue me theek hain
331,Should I avoid caffeine?,Kya caffeine se parhez karun?,Limit caffeine because it may worsen dehydration.,Caffeine kam karein kyun ke dehydration barh sakta hai.,nutrition;hydration,Clinical,general,should i avoid caffeine,kya caffeine se parhez karun,should i avoid caffeine kya caffeine se parhez karun
332,Should I avoid very sugary drinks?,Kya bohat meetha peena theek nahi?,"Yes, they may cause stomach discomfort; prefer ORS.","Haan, pait kharab kar sakta hai; ORS behtar hai.",nutrition,Education,general,should i avoid very sugary drinks,kya bohat meetha peena theek nahi,should i avoid very sugary drinks kya bohat meetha peena theek nahi
333,Is soup good during dengue?,Kya yakhni dengue me faida karti hai?,"Yes, soups support hydration and electrolytes.","Haan, yakhni hydration aur namak poora karti hai.",nutrition;hydration,WHO,general,is soup good during dengue,kya yakhni dengue me faida karti hai,is soup good during dengue kya yakhni dengue me faida karti hai
334,Is milk good in dengue?,Kya doodh dengue me theek hai?,Safe if tolerated; avoid if it causes nausea.,Agar hazm ho to theek; agar ghulati day to parhez.,nutrition,Clinical,general,is milk good in dengue,kya doodh dengue me theek hai,is milk good in dengue kya doodh dengue me theek hai
335,Can I eat eggs?,Kya anday dengue me khaye ja sakte hain?,"Yes, eggs provide protein and are safe.","Haan, anday protein detey hain aur safe hain.",nutrition,Education,general,can i eat eggs,kya anday dengue me khaye ja sakte hain,can i eat eggs kya anday dengue me khaye ja sakte hain
336,Are fried foods harmful?,Kya talay huay khanay nuqsan detey hain?,They may worsen nausea; prefer light meals.,Yeh ghulati barhate hain; halka khana behtar hai.,nutrition,Education,general,are fried foods harmful,kya talay huay khanay nuqsan detey hain,are fried foods harmful kya talay huay khanay nuqsan detey hain
337,Can dengue cause weight loss?,Kya dengue se wazan kam hota hai?,Temporary weight loss is common due to poor appetite.,Bhook kam honay se wazan gir sakta hai.,recovery,Clinical,general,can dengue cause weight loss,kya dengue se wazan kam hota hai,can dengue cause weight loss kya dengue se wazan kam hota hai
338,How long to regain strength?,Taqat wapas anay me kitna waqt lagta hai?,Most regain strength in 2–4 weeks depending on severity.,Aksar 2–4 haftay lagtay hain severity par depend karta hai.,recovery,Clinical,general,how long to regain strength,taqat wapas anay me kitna waqt lagta hai,how long to regain strength taqat wapas anay me kitna waqt lagta hai
339,Does dengue cause muscle fatigue?,Kya dengue me pathon ki thakan hoti hai?,"Yes, viral inflammation causes muscle fatigue.","Haan, virus se soozish pathon ko thaka deti hai.",symptoms;muscle,WHO,general,does dengue cause muscle fatigue,kya dengue me pathon ki thakan hoti hai,does dengue cause muscle fatigue kya dengue me pathon ki thakan hoti hai
340,Does dengue cause skin sensitivity?,Kya dengue me jild hassaas ho jati hai?,"Yes, fever and rash may cause skin tenderness.","Haan, bukhar aur rash jild ko hassaas bana sakte hain.",symptoms;skin,Clinical,general,does dengue cause skin sensitivity,kya dengue me jild hassaas ho jati hai,does dengue cause skin sensitivity kya dengue me jild hassaas ho jati hai
341,Is red rash dangerous?,Kya surkh rash khatarnak hai?,Most rashes are harmless but bleeding spots require urgent care.,Aksar rash be-nuqsan hota hai magar khuni nishanat par foran madad lein.,symptoms;rash,WHO,general,is red rash dangerous,kya surkh rash khatarnak hai,is red rash dangerous kya surkh rash khatarnak hai
342,Does dengue cause peeling skin?,Kya dengue ke baad jild utar sakti hai?,Mild peeling may occur in recovery.,Recovery ke douran halki jild utar sakti hai.,recovery;skin,Clinical,general,does dengue cause peeling skin,kya dengue ke baad jild utar sakti hai,does dengue cause peeling skin kya dengue ke baad jild utar sakti hai
343,Can dengue cause back stiffness?,Kya dengue me kamar sakhti hoti hai?,Common due to muscle inflammation.,Aam hai soozish ki wajah se.,symptoms;muscle,Clinical,general,can dengue cause back stiffness,kya dengue me kamar sakhti hoti hai,can dengue cause back stiffness kya dengue me kamar sakhti hoti hai
344,Is dizziness always serious?,Kya chakkar hamesha khatarnaak hotay hain?,Mild dizziness is from dehydration; severe dizziness is concerning.,Halka dehydration se; shadeed ho to khatray ki nishani.,symptoms;hydration,WHO,general,is dizziness always serious,kya chakkar hamesha khatarnaak hotay hain,is dizziness always serious kya chakkar hamesha khatarnaak hotay hain
345,Does dengue cause irritability?,Kya dengue me chirchira-pan hota hai?,Illness stress and poor hydration may cause irritability.,Stress aur dehydration is ka sabab hote hain.,symptoms;mental,Clinical,general,does dengue cause irritability,kya dengue me chirchirapan hota hai,does dengue cause irritability kya dengue me chirchirapan hota hai
346,Can dengue cause mood swings?,Kya mood bar bar badalta hai?,"Yes, due to fatigue and illness stress.","Haan, thakan aur stress se.",symptoms;mental,Clinical,general,can dengue cause mood swings,kya mood bar bar badalta hai,can dengue cause mood swings kya mood bar bar badalta hai
347,Does dengue affect sleep?,Kya dengue me neend masla hota hai?,"Yes, fever and pain disrupt sleep.","Haan, bukhar aur dard neend ko asar karte hain.",symptoms;sleep,Clinical,general,does dengue affect sleep,kya dengue me neend masla hota hai,does dengue affect sleep kya dengue me neend masla hota hai
348,Does dengue cause chills?,Kya dengue me kapkapi hoti hai?,"Yes, chills occur with fever spikes.","Haan, bukhar barhne se.",symptoms;fever,WHO,general,does dengue cause chills,kya dengue me kapkapi hoti hai,does dengue cause chills kya dengue me kapkapi hoti hai
349,Does dengue cause cold hands?,Kya dengue me haath thanday hotay hain?,Cold extremities may indicate poor circulation—seek care.,Thanday haath circulation maslay ki nishani ho sakte hain.,warning_signs;circulation,WHO,general,does dengue cause cold hands,kya dengue me haath thanday hotay hain,does dengue cause cold hands kya dengue me haath thanday hotay hain
350,Can dengue cause swelling of feet?,Kya dengue me paon sooj jate hain?,Swelling may occur in leakage—requires assessment.,Leakage me soojan hoti hai; muaina zaruri hai.,severe_dengue;swelling,WHO,general,can dengue cause swelling of feet,kya dengue me paon sooj jate hain,can dengue cause swelling of feet kya dengue me paon sooj jate hain
351,Does dengue cause coughing?,Kya dengue me khansi hoti hai?,Mild cough may occur but persistent cough requires evaluation.,Halki khansi hosakti hai; zyada ho to muaina karein.,symptoms;respiratory,Clinical,general,does dengue cause coughing,kya dengue me khansi hoti hai,does dengue cause coughing kya dengue me khansi hoti hai
352,Does dengue cause sore throat?,Kya dengue me gala dard hota hai?,Occasionally; not a defining symptom.,Kabhi kabhi; magar khas alamat nahi.,symptoms;throat,Clinical,general,does dengue cause sore throat,kya dengue me gala dard hota hai,does dengue cause sore throat kya dengue me gala dard hota hai
353,Can dengue cause fainting?,Kya dengue me behoshi hosakti hai?,"Yes, fainting suggests severe dehydration or shock—urgent care needed.","Haan, behoshi dehydration ya shock ki nishani hai.",warning_signs;severe,WHO,general,can dengue cause fainting,kya dengue me behoshi hosakti hai,can dengue cause fainting kya dengue me behoshi hosakti hai
354,Does dengue cause pale skin?,Kya dengue me rang feeka hota hai?,"Yes, may indicate dehydration or bleeding.","Haan, pani ki kami ya bleeding ki nishani.",symptoms;circulation,WHO,general,does dengue cause pale skin,kya dengue me rang feeka hota hai,does dengue cause pale skin kya dengue me rang feeka hota hai
355,Does dengue cause fast heartbeat?,Kya dengue me dharkan tez hoti hai?,Common due to fever and dehydration.,Bukhar aur dehydration se aam hai.,symptoms;cardio,WHO,general,does dengue cause fast heartbeat,kya dengue me dharkan tez hoti hai,does dengue cause fast heartbeat kya dengue me dharkan tez hoti hai
356,Can dengue affect the lungs?,Kya dengue phaypron ko asar karta hai?,Severe leakage may cause fluid in lungs—emergency.,Severe leakage me phepron me maye jama hosakta hai.,severe_dengue;respiratory,WHO,general,can dengue affect the lungs,kya dengue phaypron ko asar karta hai,can dengue affect the lungs kya dengue phaypron ko asar karta hai
357,Can dengue affect the brain?,Kya dengue dimagh ko asar karta hai?,"Rare, but confusion is a serious warning sign.",Kam hota hai; uljhan serious nishani hai.,warning_signs;neuro,WHO,general,can dengue affect the brain,kya dengue dimagh ko asar karta hai,can dengue affect the brain kya dengue dimagh ko asar karta hai
358,Is shaking normal?,Kya komp aam hai?,Fever chills cause shaking; severe tremors need evaluation.,Kapkapi se komp hota hai; shadeed ho to muaina karein.,symptoms;fever,WHO,general,is shaking normal,kya komp aam hai,is shaking normal kya komp aam hai
359,Does dengue cause low sodium?,Kya dengue me sodium kam hota hai?,Mild hyponatremia is common and monitored clinically.,Halki kami aam hai; doctors nigrani karte hain.,labs;electrolytes,Clinical,general,does dengue cause low sodium,kya dengue me sodium kam hota hai,does dengue cause low sodium kya dengue me sodium kam hota hai
